facet;Group;Pathway;adj_p_value;-log10adj.p;NES
Non-classical;3vs0;RESPONSE TO TOPOLOGICALLY INCORRECT PROTEIN;3.0881052648565E-07;6.51030790420186;2.44909988227249
Non-classical;3vs0;CHAPERONE COFACTOR DEPENDENT PROTEIN REFOLDING;8.40790664182894E-06;5.07531211919242;2.44557007104855
Non-classical;3vs0;CELLULAR RESPONSE TO HEAT;0.000490905855462694;3.30900178765982;2.25586824044847
Non-classical;3vs0;POSITIVE REGULATION OF CYTOKINE PRODUCTION;1.2738660268499E-07;6.8948762445747;2.25068841920553
Non-classical;3vs0;CHAPERONE MEDIATED PROTEIN COMPLEX ASSEMBLY;0.0000809621273383558;4.09171808895325;2.24349862399101
Non-classical;3vs0;REGULATION OF RESPONSE TO BIOTIC STIMULUS;0.0000342046322717917;4.46591507424075;2.08715600063254
Non-classical;3vs0;RESPONSE TO CYTOKINE;2.11595336181081E-08;7.67449390891068;2.06856999260812
